Reference Number ,subtitle,photo_url,question,answer,optionA,optionB,optionC
1186,,,"Before each flight, the remote PIC must ensure that",C,ATC hs granted clearance. ,the site supervisor has approved the flight. ,objects carried on the sUAS are secure. 
1300,,,What purpose does a rudder perform on an sUAS airplane?,A,The rudder controls yaw. ,The rudder controls bank. ,The rudder controls pitch. 
1187,,,You are operating an sUAS that does not have GPS or an installed ground speed limiter. How can you determine the speed you are operating? ,A,Dead reckoning.,Pilotage. ,Wind triangle. 
1188,,,How can a remote pilot determine the altitude of the terrain and structures where the flight will be conducted?,A,Sectional Chart. ,Manufactures data. ,Road maps. 
1189,,,You are operating an sUAS that does not have GPS or an installed ground speed limiter. How can you determine the speed you are operating? ,A,Gaining a visual perspective of what 400 feet looks like on the ground before the flight. ,Operating a second sUAS that has an altimeter to gain a visual perspective of 400 feet from the air. ,Operating the sUAS in close proximity of a tower known to be 400 feet tall. 
1190,,,"When loading cameras or other equipment on as sUAS, mount the items in a manner that ",B,is visible to the visual observer or other crewmembers. ,does not adversely affect the center of gravity.,can be easily removed without the use of tools. 
1191,,,"To ensure that the unmanned aircraft center of gravity (CG) limits are not exceeded, follow the aircraft loading instructions specified in the",B,Aircraft Weight and Balance Handbook.,Pilot's Operating Handbook or UAS Flight Manual. Aeronautical Information Manual (AIM),Aeronautical Information Manual (AIM).
1192,,,What could be a consequence of operating of operating a small unmanned aircraft above its maximum allowable weight?,A,Shorter endurance.,Increased maneuverability.,Faster speed. 
1193,,,"When operating an aircraft, the Remote PIC is responsible for using",A,the most current weight and balance data. ,weight and balance data from the factory ,recent weight and balance data. 
1194,,,Which of the following is true regarding weight and balace of small unmanned aircraft?,C,CG cannot change during flight. ,Lateral CG is not important to small unmanned aircraft operations. ,Operations outside weight and balance limitations may result in loss of control. 
1293,,,A UAS loaded the most rearward center of gravity is ,A,less stable at all speeds.,more stable at slow speeds. ,more stable at fast speeds. 
1195,,,"When operating an unmanned aircraft, the remote pilot-in-command should consider that the load factoron the wings or rotors may be increased anytime",A,the aircraft is subjected to maneuvers other than straight and level flight.,the CG is shifted rearward to the aft CG limit. ,the gross weight is reduced. 
1196,(Refer to Figure 2.) ,,"If an sUAS weighs  10 pounds, what approximate weight  would the sUAS structure be required to support during a 60° banked turn while maintaining altitude?",C,10.15 pounds.,30 pounds.,20 pounds.
1197,(Refer to Figure 2.) ,,"If an sUAS weighs 50 pounds, what approximate weight would the sUAS structure be required to supoport during a 30° banked turn while maintaining altitude?",A,60 Pounds ,45 pounds. ,30 pounds.
1198,(Refer to Figure 2.) ,,"If an unmanned airplane weighs 33 pounds, what approximate weight would the airplane structure be required to support during a 30° banked turn while maintaining altitude?",C,34 pounds.,47 pounds.,38 pounds.
1199,,,The amount of excess load that can be imposed on the wing of an airplane depends upon the ,B,position of the CG. ,speed of the airplane.,abruptness at which the load is applied. 
1200,,,Which basic flight maneuver increases the load factor on an sUAS as compared to straight-and-level flight?,B,Climbs. ,Turns. ,Stalls. 
1201,,,"The term ""angle of attack"" is defined as the angle",A,between the wing chard line and the relative wind. ,between the airplane's climb angle and the horizon. ,formed by the longitudinal axis of the airplane and the chord line of the wing. 
1202,,,The angle of attack at which an airfoil stalls will ,B,increase if the CG is moved foward. ,remain the same regardless of gross weight. ,change with an increase in gross weight. 
1203,,,"A stall occurs when the smooth airflow over the unmanned aircraft's wing/propeller(s) is disrupted, and the lift reduces rapidly. This is caused when the wing/propeller(s)",C,exceeds maximum allowable operation weight. ,exceeds the maximum speed. ,exceepds its critical angle of attack. 
1204,,,An increase in load factor will cause an unmanned aircraft to ,A,stall at a higher airspeed. ,have a tendency to spin. ,be more difficult to control.
1314,,,"In a 45° banking turn, a UA will ",B,be more susceptible to spinning. ,stall at a higher airspeed. ,stall at a lower airspeed. 
1205,,,"According to 14 CFR Part 107, who is responsible for determining the performance of a small unmanned aircraft?",A,Remote pilot-in-command.,Manufacturer.,Owner of operator. 
1206,,,What effect does an uphill terrain slope have on launch performance?,B,Increases launch speed. ,Increases launch distance. ,Decreases launch distance. 
1207,,,"The most critical conditions of launch performance are the result of some combination of high gross weight, altitude, temperature, and ",A,unfavorable wind. ,obstacles surrounding the launch site. ,powerplant systems. 
1208,,,Maximum endurance is obtained at the point of minimum power to maintain the aircraft,A,"in steady, level flight.",in a long range descent. ,at its slowest possible indecated airspeed. 
1209,,,"When range and economy of operation are the principle goals, the remote pilot must ensurethat the sUAS will be operated at the recommended",B,specific endurance. ,long-range cruise performance. ,equivalent airspeed.
1210,,,What is the best source for sUAS performance data and information?,A,Manufacturer publications. ,Pilot reports. ,Estimates based upon similar ststems. 
1211,,,During the preflight inspection who is responsibile for determining the aircraft is safe for flight?,A,The remote pilot in command. ,The owner or operator.,The certificated mechanic who performed the annual inspection. 
1212,,,How often is the remote PIC required to inspect the sUAS to insure that it is in a condition for safe operation?,C,Annually.,Monthly. ,Before each flight. 
1213,,,How should an sUAS preflight inspection be accomplished for the first flight of the day?,B,Quick walk around with a check of gas and oil. ,Thorough and systematic means recommended by the manufacturer. ,Any sequence as determined by the pilot-in-command. 
1214,,,"During you preflight inspection, you discover that the casing of your sUAS battery has expanded beyond its normal dimensions. What action should you take?",C,Throw it away with your household trash. ,Use it as long as it will still hold a charge. ,Follow the manufacturer's guidance. 
1215,,,"While preparing your sUAS for flight, you notice that one of the propeller blades has a nick. What action should you take?",B,"If the nick is less than 1/4 the length of the blade, it is safe to operate without replacement. ","Remove and replace the propeller; consult manufacturer guidlines for repair, if any. ",Repair by filiing the nick to a smooth curve or with adhesive approved for use on the propeller material. 
1216,,,In which of the following scenarios is a remote PIC not required to perform a preflight inspection of their sUAS?,C,If the subsequent flight occurs immediately following a flight before which an inspection was made. ,"Preflight inspections are only required for the first flight of the day, so any other flight does not require such as inspection. ","Preflight inspections are required before each flight, thus there is no scenario that precludes such an inspection."
1217,,,"Inbound to an airport with no tower, FSS, or UNICOM in operation, a pilot should self-announce on MULTICOM frequency ",B,123.0. ,122.9.,122.7.
1279,,,The aircraft call sign N169US will be spoken in this way:,A,November one six noner uniform sierra. ,November one six niner unmanned system. ,November one hundred one hundred sixty nine uniform sierra. 
1218,,,"When flying HAWK N666CB, the proper phraseology for initial contract with Whitted ATC tower is",A,"""Whitted Tower, HAWK SIX SIX SIX CHARLIE BRAVO , five NM west of the airport, request permission to enter Class D airspace  for unmanned aircraft operations below four hundred AGL, three NM west of the airport"" ","""Whitted, HAWK SIX SIX SIX CEE BEE, requesting to operate within Class D, west of the field""","""Whitted tower, Triple Six Charlie Bravo, five NM west,  operating in Class D below four hundred AGL west of the airport"""
1219,,,"The correct nethod of stating 4,500 feet MSL to ATC is ",A,"""FOUR THOUSAND FIVE HUNDRED.""","""FOUR POINT FIVE.""","""FORTY-FIVE HUNDRED FEET MSL."""
1233,,,What is the best way for the remote PIC to minimize the risk of radio frequency interference during sUAS operations?,B,Never transit on aviation frequency ranges during flight operations. ,Monitor frequency use with a spectral analyzer. ,Avoid the use of cellphones in the vicinity of the control station. 
1220,"(Refer to FIgure 20, area 3.)",https://i.imgur.com/d7YF7CJ.jpg,What is the recommended communications procedure for a landing at Currituck County Airport?,A,Transmit intentions on 122.9MHz  when 10 miles out and give positions reports in the traffic pattern. ,Contact Elizabeth City FSS for airport advisory service. ,Contact New Bern FSS for area traffic information. 
1221,,,When should pilots state their position on the airport when calling the tower for takeoff?,C,When visibility is less than 1 mile. ,When parallet runways are in use. ,When departing from a runway intersection. 
1222,,,"As standard operating practice, all inbound and local traffic approaching or near an airport without a control tower should continuously monitor the appropriate facility from a distance of",C,25 miles. ,20 miles. ,10 miles.
1223,,,Absence of the sky condition and visibility on an ATIS broadcast indicates that,C,weather conditions are at or above VFR minimums ,the sky condition is clear and visibility is unrestricted.,"the ceiling is at least 5,000 feet and visibility is 5 miles or more. "
1330,"(Refer to Figure 21, Area 1.) ",https://i.imgur.com/Zx6EcdC.jpg,"After receiving authorization from ATC to operate a small UA near Minot International Airport (MOT) while the control tower is operational , which radio communication frequency could be used to monitor manned aircraft and ATC communications?",C,UNICOM 122.95,ASOS 118.725,CT-118.2
1225,"(Refer to Figure 26, Area 2.)",https://i.imgur.com/VcrUqUa.jpg,What is the recommended communication procedure when operating in the vicity of Cooperstown Airport?,A,"Broadcast intentions when 10 miles out and monitor transmission on the CTAF/MULTICOM frequency, 122.9 MHz ",Contact UNICOM when 10 miles out on 122.8 MHz.,Circle the airport in the left turn prior to entering traffic monitoring transmissions on 122.9.
1308,,,The Common Traffic Advisory Frequency (CFAT)is used for manned aircraft to ,A,announce ground and flight intentions. ,request air traffic control clearance. request fuel servies. ,request fuel services. 
1226,,,Automatic Terminal Information Service (ATIS),C,pilots of radar-identified aircraft whose aircraft is in dangerous proximity to terrain or to an obstruction. ,nonessential information to reduce frequency congenstion. ,noncontrol information in selcted high-activity terminal areas. 
1227,,,What services will a FSS provide?,B,Fuel pricing. ,Assistance during an emergency. ,Clearance to taxi for takeoff. 
1230,,,"An ATC fadar facility issues the following advisory to a pilot flying on a heading of 090° :""UNMANNED AIRCRAFT OPERATIONS 3 O'CLOCK, 2 MILES, WESTBOUND..."" Where should the Remote PIC (also visual observer and crew, if applicable) look for this traffic in reference to the UA?",A,North. ,South. ,West.
1231,,,"An ATC radar facility issues the following advisory to a manned aircraft pilot flying north in a calm wind: ""UNMANNED AIRCRAFT OPERATIONS AT 9 O'CLOCK, 2 MILES..."" Where should the Remote PIC (also visual observer and crew. if applicable) look for this traffic?",A,East.,North. ,West. 
1232,,,A visual observer notices a manned aircraft approaching the area in which sUAS operations are east. What call could the remote PIC/visual observer make on CTAF to alert the manned pilot?,A,"Zephyrhills traffic, unmanned aircraft Xray Yankee Zulu, operating five NM south of the airport at or below 400 AGL, located at the three o'clock position of the Cessna just north of our position,  Zephyrhills traffic. ","Zephyrhills traffic, unmanned aircraft at three o'clock of manned aircraft in the area, Zephyrhills traffic. ","Zephyrhills traffic, unmanned aircraft Xray Yankee Zulu to Cessna in the area, look for us at your three o'clock position, we are about a mile south. "
1234,,,Damaged lithium batteries can cause ,A,an inflight fire. ,a change in aircraft center of gravity.,increased endurance. 
1334,,,What precautions should a remote PIC take to prevent possible inflight emergencies when using lithium-based batteries?,B,Store the batteries in a freezer to allow proper recharging. ,Follow the manufacturer's recommendations for safe battery handling. ,Allow the battery to charge until it reaches a minimum temperature of 100°C. 
1335,,,A remote pilot-in-command and a visual observer defining their roles and responsibilites prior to and during the operation of a small UA is a good use of,A,Crew resource management. ,Authoritarian resource management. ,Single pilot resource management.
1235,,,Which of the following lithium batteries should not be used?,C,A partially discharged battery that is warm from recent prior use. ,"A new battery that has only been charged one, several charging cycles are required prior to normal use. ",A battery with a bulge on one of the sides of its case. 
1236,,,What is the proper response by the remote PIC if experiencing a lost link situation?,A,Notify all available crew and ATC (if applicable) while executing the briefed lost link procedure. ,Wait for the unit to reestablish link while notifying local law enforement of possible dangers to nonparticipants. ,Turning the control station off and then back on to attempt the reestablishment of the link. 
1237,,,Which of the following events is considered a flyaway?,C,Loss of link between the remote PIC and the unmanned aircraft. ,Loss of communication link between the Remote PIC and ATC.,Unmanned aircraft does not respond to control inputs and does not execute known lost link maneuvers. 
1238,,,What action should be taken by the remote PIC during a sUAS flyaway event?,B,Immediately notify the NTBS. ,"Immediately notify any/all crewmembers, bystanders, and ATC (if applicable).","Immediatly notify any/all crewmembers, local law enforcement personnel, and bystanders. "
1239,,,A common cause of sUAS flyaway events is ,A,frequency interference.,loss of GPS signals.,persons standing close to the control station antenna. 
1241,,,What action should the remote PIC take upon GPS signal loss?,B,Perform the planned flyaway emergency procedure. ,Follow normal sUAS operational procedures noting any mode or control changes that normally occur if GPS is lost. ,Land the unmanned aircraft immediately prior to loss of control. 
1242,,,"The effective use of all available resources human, hardware, and information-prior to and during flight to ensure the successful outcome of the operation is called",B,risk management. ,crew resource management. ,safely management system. 
1243,,,"When adapting crew resource management (CRM) concepts to the operation of a small unmanned aircraft, CRM must be integrated info. ",C,the communications only. ,the flight portion only. ,all phases of the operation. 
1244,,,"Safely is an important element for a remote pilot to consider prior to operating an unmanned aircraft system. To prevent the final ""link"" in the accident chain, a remote pilot must consider which methodolgy? ",C,Crew resource management. ,Safety management system. ,Risk management. 
1245,,,A local TV station has hired a remote pilot to operate their small UA to cover breaking news stories. The remote pilot has had multiple near misses with obstacles on the ground and two small UAS accidents.What would be a solution for the news station to improve their operating safely culture?,C,The new station should implement a policy of no more than five crashes/incidents within 6 months. ,The news station does not need to make any changes; there are times that an accident is unavoidable.,The news stations should recognize harardous attitudes and situations and develope standard operating procedures that emphasize safety. 
1246,,,Identify the hazardous attitude or characteristic a remote in command displays while taking risks in order to impress others?,C,Impulsivity,Invulnerability. ,Machoism. 
1247,,,"You have been hired as a remote pilot in command by a local TV news station to film breaking news with a small unmanned aircraft. You expressed a safety concern and the station manager has  instructed you to ""fly first, ask question later."" What type of hazardous attitude does this attitude represent?",B,Invulneratbility. ,Impulsivity.,Machoism. 
1248,,,"What antidotal phrase can help reverse the hazardous attitude of ""antiauthority""?",C,Rules do not apply in this situation. ,I know what I am doing. ,Follow the rules. 
1249,,,Hazardous attitudes occur to every pilot to some degree at some time. What are some of these hazardous attitudes?,B,Poor risk management and lack of stress management. ,"Antiauthority, impulsivity, macho, resignation, and invulnerability. ","Poor situational awareness, snap judgments, and lack of a decision making process. "
1250,,,"Risk management, as part of the aeronautical desicion making (ADM) process, relies on which features to reduce the risks associated with each flight?",B,Application of stress management and risk element procedures. ,"Situational awareness, problem recognition, and good judgement. ",The mental process of analyzing all information in a particular situation an  making a timely decision on what action to take. 
1251,,,"To avoid missing imporatant steps, always use the ",A,appropriate checklists. ,placarded airspeeds. ,airworthiness certificate. 
1252,,,An exreme case of a pilot getting behind the aircraft can lead to the operation pitfall of ,A,loss of situational awareness. ,loss of workload. ,internal stress.
1253,,,Which statement is not correct concerning crew resource management in sUAS operations?,A,"Crewmembers cannot, under any circumstances, challenge the decision of the remote PIC ",Individuals who are exhibiting signs of hazadous attitudes should be approached about the issue. ,The remote PIC and all crewmembers should communicate any observed hazards or concerns to one another. 
1284,,,A remote pilot-in-command and a visual observer define their roles and responsibilities prior to and during the operation of a small UA. This is a good use of ,A,crew resource management. ,Authoritarian resource management. ,Single pilot resource management.
1291,,,What antidotal phrase can help reverse the hazardous attitude of impulsivity?,C,It could happen to me. ,Do it quickly to get it over with. ,"Not so fast, think first. "
1299,,,What is the best way to mitigate risk?,C,SMS plan.,Weekly meetings. ,Establishing an operational procedure guideline. 
1315,,,The accurate perception and understanding of all the risk element factors and conditions is ,A,situational awareness. ,judgement. ,aeronautical decision making. 
1337,,,Aernautical decision making (ADM) can be described as the pilot's ability for ,A,sound judgement and good decision making.,making quick decisive actions.,interpreting dangerous situations. 
1254,,,"Who is responsible for determining whether a pilot is fit to fly for a particular flight, even though he or she holds a current medical certificate?",C,The FAA,The medical examiner.,The pilot. 
1255,,,"You are a remote pilot in command for a co-op energy service proveder. You plan to use your unmanned aircraft to inspect powerlines in the remote area 15 hours away from your home office. After you drive, fatigue impacts your abilites to complete your assignment on time. What kind of fatigue is this?",B,Chronic fatigue. ,Acute fatigue. ,Exhaustion. 
1302,,,What can affect your performance?,C,Prescription medications. ,Over-the counter medications. ,Over-the-counter and prescribed medications. 
1258,,,Fatigue can be recognized,B,easily by an experienced pilot. ,as being in an impaired state. ,by an ability to overcome sleep deprivation. 
1257,,,Fatigue can be either,C,physiological or psychological. ,physical or mental. ,acute or chronic.
1258,,,Fatigue is one of the most treacherous hazards to flight safely ,B,because it results in slow performace.,as it may not be apparent until serious errors are made. ,as it may be a function of physical robustness or mental acuity. 
1259,,,"When a stressful situation is encoutered in flight, an abnormal increase in the volume of air breathed in and out can cause a condition known as ",A,hyperventalation. ,aerosinusitis. ,aerotitis. 
1260,,,Which would most likely result in hyperventilation?,A,"Emotional tension, anxiety, or fear. ",The excessive consumption of alcohol. ,An extremely slow rate of breathing and insufficient oxygen. 
1261,,,Which will almost always affect you ability to fly?,C,Over-the counter analgesics and antihistamines.,Antibiotics and anesthetic drugs. ,Prescription analgesics and antihistamines.
1262,,,"As a pilot, flying for long periods in hot summer temperatures increases the susceptibility of dehyration since the ",A,dry air at altitude tends to increase the rate of water loss from the body. ,moist air at altitude helps retain the body's moisture. ,temperature decreases with altitude. 
1273,,,Which would most likely result in hyperventilation?,C,Insufficient oxygen.,Excessive carbon monoxide. ,Insufficient carbon dioxide.
1263,,,"When setting up the loaction of the control station and placement of crewmembers for an afternoon flight, which of the following would be most appropriate for ensuring that vision is not impaired by the enviornment?",A,The operation should be set up so that the remote PIC and crewmembers can face east.,The operation should be set up so that the remote PIC and crewmembers are facing west ,The operation should be set up so that the remote PIC and crewmembers are facing any reflective objects in the area. 
1297,,,What can help a pilot mitigate stress?,B,Increasing stress tolerance.,Removing stress from personal life. ,Breathing into a paper bag. 
1264,,,"When setting up the loaction of the control station and placement of crewmembers for an flight over snowy terrain, which  of the following would be most appropriate for ensuring that vision is not impaired by the environment?",B,The operation should be set up so that the crewmembers are the most comfortable. ,The operation should be set up so that the crewmembers will experience the minimum glare from the snow. ,The operation should be set up so that the crewmembers face the direction in which the terrain most closely matches the color of the unmanned aircraft. 
1265,,,Which of the following sources of information should consult first when determining what maintenance  should be performed on an sUAS or its components?,C,Local pilot best prictices. ,14 CFR Part 107.,Manufacturer guidance. 
1266,,,Under what condition should the operator of a small unmanned aircraft elstablish a scheduled maintanance protocol? ,A,When the manufacturer does not provide a maintenance schedule. ,When the FAA requires you to. following an accident.,Small unmanned aircraft system do not require maintenance. 
1336,,,What action should the operator of an sUAS take if the manufacturer does not provide information about scheduled maintenance?,B,The operator should contact the FAA for a minimum equipment list. ,The operator should establish a scheduled maintenance protocol. ,The operator should contact the NTSB for component failure rates for their specific sUAS. 
1267,,,Scheduled maintenance should be performed in accordance with the ,A,Manufacturer's suggested procedures. ,Stipulations in 14 CFR Part 43. ,Contractor requirements. 
1268,,,The responsibility for ensuring that an sUAS is maintained in an airworthy condition is primarily that of the ,A,Remote pilot-in-command.,owner of operator. ,mechanic who performs the work. 
1269,,,When should the battery for an unmanned aircraft be replaced?,B,Once recharged more than 10 times in the preceding 30 days. ,"Per the guidelines of the sUAS manufacturer of the battery manufacturer, whichever is more restrictive ","Per the guidlines of the sUAS manufacturer or the battery manufacturer, whichever is least restrictive. "
,,,,,,,
,,,,,,,
,,,,,,,
,,,,,,,
,,,,, zoo,,