Reference Number ,subtitle,photo_url,question,answer,optionA,optionB,optionC
1091,"(Refer to Figure 24, Area 5.)",https://i.imgur.com/iT2jCsZ.jpg,You are operating an sUAS in the vicinity of Suphur Springs Airport(SUR) where there is active air traffic. Who has priority and right-of-way  within the traffic pattern area?,C,Priority and right-of-way goes to the aircraft closest to the landing runway. ,The sUAS.,The existing manned aircraft.
1092,"(Refer to Figure 71, Area 6.)",https://i.imgur.com/D9n832z.jpg,Sky Way Airport is ,C,an airport restricted to use by private and recreational pilots. ,a restricted military stage field within restricted airspace.,a nonpublic use airport. 
1093,"(Refer to Figure 71, Area 1.)",https://i.imgur.com/D9n832z.jpg,The floor of the Cass E airspace above Georgetown Airport (E36) is at ,C,the surface.,700 feet AGL.,"3,823 feet MSL "
1094,(Refer to Figure 75.),https://i.imgur.com/oo3JxLY.jpg,The airspace surrounding the Gila Bend AF AUX Airport (GXF) (area 6) is classified as Class,C,B.,C.,D.
1095,,,"Under what condition, if any, may remote pilots fly through restricted area?",B,When flying on airwats with an ATC clearance. ,With the controlling agency's authorization. ,Regulations do not allow this.
1296,,,Where can you find information about operating in an MOA along you planned route of flight?,A,Sectional chart. ,Chart supplement. ,Aeronautical Information Manual. 
1309,"(Refer to Figure 75, Area 6.)",https://i.imgur.com/oo3JxLY.jpg,"During preflight planning, you plan to operate in R-2305.Where would you find additional information regarding this airspace?",A,In the Special Use Airspace area of the chart. ,In the Aeronautical information Manual. ,In the Charts Supplements U.S. 
1331,"(Refer to Figure 24, Area 6.)",https://i.imgur.com/iT2jCsZ.jpg,What type of airport is Card Airport?,C,Public towered.,Public non-towered.,Private non-towered.
1096,(Refer to Figure 26.),https://i.imgur.com/bwhxaAK.jpg,What does the line of latitiude  at area 4 measure?,B,The degrees of latitude east and west of the Prime Meridian. ,The degrees of latitude north and south of the equator. ,"The degrees of latitude east and west of the line that passes through Greenwich, England."
1097,(Refer to Figure 69.),https://i.imgur.com/gEFoUQi.jpg,What does the line of longitude at area 7 measure?,C,The degree of longitude north and south of the prime meridian. ,The degrees of longitude north and south from the equator.,"The degrees of longitude east and west of the line that passes through Greenwich, England."
1098,,,Which statement about longitude and latitude is true?,B,Lines of longitude are parallel to the Equator. ,Lines of longitude cross the Equator at right angles.,The 0 line of latitude passes through Greenwich England. 
1099,(Refer to Figure 21.),https://i.imgur.com/Zx6EcdC.jpg,What airport is located approximately 47 (degrees) 40 (minutes) N latitude and 101(degrees) 26(minutes) W longitude?,C,Mercer County Regional Airport. ,Semshenko Airport. ,Garrison Airport. 
1100,"(Refer to Figure 20, Area 3.)",https://i.imgur.com/d7YF7CJ.jpg,"With ATC authorization, you are operating your small unmanned aircraft approximately 4SM southeast of Elizabeth City Regional Airport (ECG). What hazard is indicated to be in that area?",C,High density military operations in the vicinity. ,"Unmarked ballon on a cable up to 3,008 feet AGL. ","Unmarked balloon on a cable up to 3,008 feet MSL."
1101,"(Refer to Figure 20, Area 2.)",https://i.imgur.com/d7YF7CJ.jpg,Why would the small flag at Lake Drummond be important to a remote pilot?,A,"This is a VFR check point for manned aircraft, and a higher volume of air traffic should be expected there.",This is a GPS check point that can be used by both manned and remote pilots for orientation. ,This indicates that there will be a larger obstruction depicted on the next printing of the chart. 
1102,,,Which is true concerning the bue and magenta colors used to depict airports on Sectional Aeronautical Charts?,C,"Airports with control towers underlying Class A, B, and C airspace are magenta. ","Airports with control towers underying Class C, D and E airspace are shown in magenta.","Airports with control towers underlying Class B, C,D, and E airspace are shown in blue. "
1103,"(Refer to Figure 23, Area 3.)",https://i.imgur.com/mlGifuy.jpg,What is the height of the lighted obstacle approximately 6 nautical miles southwest of Savannah International?,C,"1,500 feet MSL","1,531 feet AGL. ","1,548 feet MSL."
1104,"(Refer to Figure 23, Area 3.)",https://i.imgur.com/mlGifuy.jpg,The top of the group obstruction approximatly 11 nautical miles from the Savannag VORTAC on the 009 radial is ,B ,400 feet AGL.,454 feet MSL. ,432 feet MSL. 
1339,(Refer to Figure 23.),https://i.imgur.com/mlGifuy.jpg,What is the maximum altitude you are permitted to fly when insecting the high-intensity towers 6 miles south west of the Savannah/Hilton Head Airport (SAV)?,A,"1,945 feet MSL. ","1,945 feet AGL. ","1,545 feet MSL. "
1332,"(Refer to Figure 20, Area 4.)",https://i.imgur.com/d7YF7CJ.jpg,A small UA is being launched 2 NM northeast of the town of Hertford. What is the height of the highest obstacle?,C,399 feet MSL.,500 feet MSL. ,500 feet AGL.
1333,"(Refer to Figure 24, Area, and Legend 1.)",https://i.imgur.com/iT2jCsZ.jpg,"For information about the parachute operations at Tri-County Airport, refer to",B,notes on the border of the chart. ,Chart supplement U.S.,the Notices to Airmen (NOTAM) publication. 
1105,"(Refer to Figure 24, Area 2.)",https://i.imgur.com/iT2jCsZ.jpg,"Operating an sUAS, can you vertically clear the obstale of the southeast  side of Winnsboro Airport?",A,Yes ,No,Maybe
1106,"(Refer to Figure 26, Area 1.)",https://i.imgur.com/bwhxaAK.jpg,You have been asked to inspect to tower just north of Binford. What restictions should the remote PIC be concerned with prior to operating the sUAS?,C,"None, the tower is in Class G airspace up to 1,200 AGL. ",Class E airspace begins at the ground as indicated by the blue hashed lines surrounding the area. ,Restricted airspace exists around the tower thus permission is required from the controlling agency.
1107,"(Refer to Figure 24, Area 1.)",https://i.imgur.com/iT2jCsZ.jpg,How close can the Remote PIC fly their sUAS to the Majors airport (GVT) without having to contact ATC?,A,4 Nautical Miles (NM),4 Statute Miles (SM),Remote PICs must contact ATC whenever operating within the magenta shading on Sectional Charts.
1108,"(Refer to Figure 22, Area 1.)",https://i.imgur.com/abBukqU.jpg,You have heen contracted to photograph Lake Pend Oreille from a vantage point just east of Cocolalla. You notice there is a hill which should provide a good place to take panoramic photographs. What is the maximum altitude (MSL) you are authorized to fly over the hill?,B,"You cannot operate your sUAS above 400 MSL, and thus cannot operate anywhere in this part of the country. ","You may operate up to 5,360 feet MSL in Class G airspace. ","You cannot operate your sUAS without ATC permission becuase you will be in Class E airspace above 1,200MS"
1109,"(Refer to Figure 20, Area 3.) ",https://i.imgur.com/d7YF7CJ.jpg,What is the latitude and longitude location of the Elizabeth City CGAS RGL (ECG)?,A,N36 16'W 76 10',W 36 16'N 76 10',N 37 0'W 77 10'
1110,"(Refer to Figure 20, Area 3.) ",https://i.imgur.com/d7YF7CJ.jpg,You need to operate your sUAS in close proximity of the Elizabeth City CGAS RGL (ECG) airport. What frequency should be used to contact ATC?,C,122.95,124.375,120.5
1229,"(Refer to Figure 20, Area 2.)",https://i.imgur.com/d7YF7CJ.jpg,What should you be aware of when operating within the vicinity of Lake Drummond?,A,High intensity of air traffic.,Terrain obstruction.,Seaplane base. 
1111,(Refer to Figure 80.),https://i.imgur.com/Z2hEbc3.jpg,What do the blue shaded lines indicate throughout this sectional excerpt?,C,Military training routes.,Airline corridors. ,Victor airways.
1112,,,The recommended entry position for manned aircraft to enter an airport traffic pattern is altitude.,B,45 to the base leg just below traffic pattern altitude. ,to enter 45 at the midpoint of the downwind leg at traffic pattern altitude.,to cross directly over the airport at traffic pattern altitude and join the downwind leg.
1114,,,Enteries into traffic patterns by manned aircraft while descending create specific collision hazards and ,A,should be avoided.,should be used whenever possible. ,are illegal. 
1115,,,What is required to enter an airport SIDA?,C,You must pass the TSA screening. ,You must have an FAA-issued pilot certificate.,You must have an airport-issued or approved ID. 
1116,,,The numbers 9 and 27 on a runway indicate that the runway is oriented approximately. ,C,009 and 027 true.,090 and 270 true.,090 and 270 magnetic.
1117,"(Refer to Figure 26, Area 2.) ",https://i.imgur.com/bwhxaAK.jpg,While monitoring the Cooperstown CTAF you hear an aircraft announce that they are midfield left downwind to RWY 13. Where would the aircraft be relative to the runway?,A,The aircraft is East. ,The aircraft is South. ,The aircraft is West. 
1118,,,An aircraft announces that they are on short  final for runway 9. Where will the aircraft be in relation to the airport?,B,North ,West ,East 
1119,,,You are conducting sUAS operation northeast craft announces that it is departing runway 36 utilizing a right traffic pattern. Will the aircraft potentially conflict with your operation?,C,"No, the aircraft will be flying on the west side of the airport. ","No, the aircraft  will be flying to the south of the airport. ","Yes, the aircraft my overfly northeast of the airport. "
1120,,,"While operating a sUAS just south of a controlled airport with authorization, ATC notifies you to stay clear of the runway 6 final approach course. What action should you take to comply with this request? ",A,Stay clear of areas to the west and north of your area of operation. ,Stay clear of areas to the east and north of your area of operation. ,Stay clear of areas to the west and south of your area of operation. 
1121,,,"When turning onto a taxiway from another taxiway, what is the purpose of the taxiway direction sign?",C,Indicates direction to take-off runway. ,Indicates designation and direction of exit taxiway from runway.,Indicates designation and direction of taxiway leading out of an intersection. 
1122,,,"When approaching holding lines from the side with the continous lines, the pilot",B,may continue taxiing. ,should not cross the line without ATC clearance. ,should continue taxiing until all parts of the aircraft have crossed the lines.
1123,,,What is the purpose of the runway/runway hold position sign?,C,Denotes entrance to runway from a taxiway. ,Denotes area protected for an aircraft approaching or departing a runway.,Denotes intersecting runways.
1124,,,What is the purpose for the runway hold position markings on the taxiway?,A,Holds aircrft short of the runway.,Allows an aircraft permission onto the runway. ,Identifies area wher aircraft are prohibited.
1125,,,Holding position signs have,B,red inscriptions on white background. ,white inscriptions on red background,yellow inscriptions on red background. 
1126,,,What is the purpose of the No Entry sign?,A,Identifies a paved area where aircraft  are prohibited from entering. ,Identifies area that does not continue beyond intersection. ,Identifies the exit boundary for the runway protected area.
1127,,,"The ""taxiway ending"" marker ",A,indicates taxiway does not continue.,identifies area where aircraft are prohibited. ,provides general taxiing direction to named taxiway. 
1128,,,Which publication contains an explanation of airport signs and markings?,A,Aeronautical Information Manual (AIM),Advisory Circulars (AC).,Char Supplement U.S. 
1129,,,"You have received authorization to operatie an sUAS at an airport. When flying the sUAS, the ATC tower instructs you to stay clear of all runways. Which situation would indicate that you are complying with this request?",C,You are on the double dashed yellow line side of markings near the runway. ,You are over dashed white lines in the center of the pavement. ,You are on the double solid yellow line side of markings near the runway. 
1130,,,Most midair collision accidents occur during,B,hazy days.,clear days. ,cloudy days.
1131,,,Which technique should a remote pilot use to scan for traffic?,C,Continuously scan the sky from right to left. ,Concentrate on relative movement detected in the peripheral vision area. ,Systematically focus on different segments of the sky for short intervals. 
1132,,,"Guy wires, which support antenna towers, can extend horizontally; therefore, the towers should be avoided horizontally by at least",A,"2,000 feet horizontally",300 feet horizontally. ,"1,000 feet horizontally. "
1133,,,What should remote pilots rely on for wire strike avoidance?,C,Sectional Chart markings ,Chart Supplement U.S. airport and airspace details. ,Visual scanning. 
1134,,,What should a remote pilot do if the sUAS they are operating collides with a bird or wildlife?,C,Report the collision to ATC.,File an accident report with the NTSB.,File a wildlife strike report with the FAA. 
1303,,,What is the most effective way for a UA pilot to scan for traffic?,B,Maintain your focus on the UA and use your peripheral vision to scan small segments of the sky. ,A series of short regulary spaced eye movements scanning 10 segments of the sky. ,Continuously scan the sky from right to left.
1312,,,A larger UAS is converging head-on; what should you do?,C,The smaller aircraft should adjust course to the right. ,The larger aircraft should adjust course to the right. ,Both aircraft should adjust course to the right. 
1135,,,Which of the following considerations is most relevant  to a remote PIC when evaluating unmanned aircraft performance?,A,Current weather conditions.,The number of available ground crew. ,The type of sUAS operation. 
1136,,,"Every physical process of weather is accompanied by, or is the result of, a ",C,movement of air. ,pressure differential. ,heat exchange. 
1137,,,What causes variations in altimeter settings between weather reporting points?,A,Unequal heating of the Earth's surface.,Variation of terrain elevation.,Coriolis force. 
1138,,,The development of thermals depends upon ,C,a counterclockwise circulation of air. ,temperature inverstions.,solar heating. 
1139,(Refer to Figure 20.),https://i.imgur.com/d7YF7CJ.jpg,Over which area should a Remot Pilot expect to find the highest amount of thermal currents under normal conditions?,A,2,7,5
1272,,,"Clouds, fog, or dew will always form when ",A,water vapor condenses. ,water vapor is present. ,relative humidity reaches 100 percent. 
1140,,,"While operating around buidlings, the remote PIC should be aware of the creation of wind gusts that ",A,change rapidly in direction and speed causing turbulance.,anhance stability and imagery.,increase performance of the aircraft.
1141,,,A strong steady wind exists out of the north. You need to photograph an area to the south of your location. You are located in an open field  with no obsructions. Which of the following is not a concern during this operation?,B,Strong wind conditions may consume more battery power at a faster rate than in calm conditions. ,Turbulent conditions will likely be a significant factor during the operation.,Strong wind may exceed the performance of the sUAS making it impossible to recover. 
1278,,,Wind shear can exist,A,at all altitudes.,at low altitudes. ,at high altitudes. 
1142,,,One of the most easily recognized discontinuities across a front is ,A,a change in temerature. ,an increase in cloud coverage. ,an increase in relative humidity. 
1143,,,One weather phenomenon which will always occur when flying across a front is a change in the ,A,wind direction.,type of prepitation. ,stability of the air mass. 
1144,,,Which type of weather phenomenon that may concern a remote pilot is common among cold fronts?,C,Long-term periods of reduced visibility.,Long periods of steady precipitation.,Thunderstorms and heavy rain. 
1286,,,What weather provides the best flying conditions?,B,"Warm, moist air ","Cool, dry air. ",Turbulence. 
1277,,,"The zone between different temperature, humidity, and wind is called",A,A front. ,An air mass. ,Wind shear.
1145,,,A stable air mass is most likely to have which characteristic? ,C,Showery precipitation. ,Turbulent air.,Poor surface visibility. 
1146,,,"What are characteristics of a moist, unstable air mass?",A,Turbulence and showery precipiatation. ,Poor visibility and smooth air.,Haze and smoke. 
1147,,,What are characteristics of stable air?,B,Good visibility and steady precipitation. ,Poor visibility and steady precipitation. ,Poor visibility and intermittent precipitation. 
1148,,,What measurement can be used to determine the stability of the atmosphere?,B,Atmospheric pressure. ,Actual lapse rate ,Surface temperature. 
1149,,,What would decrease the stability of an air mass?,A ,Warming from below. ,Cooling from below. ,Decrease in water vapor. 
1150,,,"Upon your preflight evaluation of weather, the forecasts you reference state there is an unstable air mass approaching your location. Which would not be a concern for your impeding operation?",B,Thunderstorms ,Stratiform clouds.,Turbulent conditions.
1285,,,You have received an outlook briefing from flight serice through 1800wxbried. The briefing indicates you can expect a low-level temperature inversion with high relative humidity. What weather condition would you expect?,A,"Smooth air, poor visibility, fog, haze, or low clouds.","Light wind shear, poor visibility, base, and light rain. ","Turbulent air, poor visibility, fog, low stratus type clouds, and showery precipitation. "
1151,,,What mimimum visibility is required for sUAS operations?,B,1 miles. ,3 miles. ,4 miles.
1152,,,The minimum distane from clouds required for sUAS Part 107 operation is ,B,clear of clouds. ,"500 feet blow, 2,000 feet horizontally. ","500 feet above, 1,000 feet horizontally "
1288,(Refer to Figure 69.),https://i.imgur.com/gEFoUQi.jpg,You are inspecting the lighted towers approximately 8NM SW of the Corpus Christi Intl airport (CRP). What is the lowest cloud conver that will enable you to inspect the top of the tower.,B,"1,104 feet MSL. ","1,604 feet MSL. ","1,054 feet MSL."
1271,,,The weather report lists the ceiling at 800 feet. Wht is the highest you can operate your sUAS?,C,200 feet AGL. ,800 feet AGL.,300 feet AGL. 
1289,(Refer to Figure 23.),https://i.imgur.com/mlGifuy.jpg,What are the VFR minimum visibility requirements over Plantation Airport?,C,1SM ,5SM,3SM.
1329,"(Refer to Figure 23, Area 4)",https://i.imgur.com/mlGifuy.jpg,What is the required flight visibility for a remote pilot operating an unmanned aircraft near the Plantation Airport (JYL)?,C,5 statutue miles.,1 statute mile. ,3 statute miles 
1310,(Refer to Figure 78.),https://i.imgur.com/8I4b18I.jpg,What is the minimum base of the cloud layer to fly to the top of the towers 4NM east of Onawa (K36)?,A,792 feet AGL. ,292 feet AGL. ,"1,335 feet MSL. "
1153,,,What feature is normally associated with the cumulus stage of a thunderstorm?,B,Roll Cloud.,Continuous updraft. ,Requent lightning.
1154,,,Which weather phenomenon signals the beginning of the mature stage of a thunderstorm?,B,The appearanceof an anvil top. ,Precipitation beginning to fall. ,Maximum growth rate of the clouds.
1155,,,What conditions are necessary for the formation of thunderstorms?,A,"High Humidity, lifting force, and unstable conditions.","High humidity, high temperature, and cumulus clouds.","Lifting force, moist air and extensive coud cover. "
1156,,,"During the life cycle of a thunderstorm, which stage is characterized predominately by downdrafts?",B,Cumulus ,Dissipating ,Mature. 
1157,,,Thunderstorms reach their greatest intensity during the ,A,mature stage. ,downdraft stage.,cumulus stage.
1158,,,Thunderstorms which generally produce the most intense hazard to aircraft are ,A,squall line thunderstorms. ,steady state thunderstorms.,warm front thunderstorms. 
1159,,,"A nonfrontal, narrow band of active thunderstormsthat often develop ahead of a cold front is know as a",B,prefrontal system. ,squall line.,dryline. 
1160,,,"If there is thunderstorm activity in the vicinity of an airport at which you plan to land, which hazardous atmospheric phenomenon might be expected during recovery/landing of the sUAS?",B,Precipitation static. ,Wind-shear turbulence. ,Steady rain. 
1161,,,Which weather phenomenon is always associated with a thunderstorm?,A,Lightning. ,Heavy rain.,Hail.
1162,,,Which is considered to be the. most hazardous condition when flying an sUAS in the vicinity of thunderstorms?,B,Static electricity.,Lighting. ,Wind shear and turbulence.
1163,,,What is the expected duration of an individual microburst?,C,Two minutes with maximum winds lasting approximately 1 minute.,One microburst may continue for as long as 2 to 4 hours.,Seldom longer than 15 minutes from the time the burst strikes the ground until dissipation. 
1283,,,In what stage are thunderstorms the strongest?,A,Mature . ,Dissipating.,Cumulus
1287,,,Where are squalls most likely to form?,C,High altitude.,Low altitude.,At any altitude.
1164,,,The presence of ice pellets at the surface is evidence that there,C,are thunderstorms in the area.,has been cold frontal passage. ,is a temperature inversion with freezing rain at a higher altitude. 
1165,,,One in-flight condition necessary for structural icing to form is,C,small temperature/dewpoint spread. ,Stratiform clouds.,visible moisture. 
1166,,,In which environment is aircraft structural ice most likely to have the highest accumulation rate?,C,Cumulus clouds with below freezing temperatures. ,Freezing drizzle. ,Freezing rain. 
1298,,,What environment is most conducive to frost formation?,A,"Dewpoint of surface is below freezing, dewpoint is above freezing. ","Surface temperature is below freezing, air temperature is below freezing. ","Surface temperature is above freezing, air temperature is below freezing."
1167,,,What situation is most conducive to the formation of radiation fog?,A,"Warm, moist air over low, flatland areas on clear,calm mights.","Moist tropical air moving over cold, offshore water.",The movement of cold air over much warmer water. 
1168,,,In which situation is advection fog most likely to form?,B,"W warm, moist air mass on the windward side of mountains. ",An air mass moving inland from the coast in winter.,A light breeze blowing colder air out to sea. 
1169,,,An air mass moving inland from the coast in winter is likely to result in ,B,rain.,fog.,frost. 
1170,,,What types of fog depend upon wind in order to exist?,C,Raidiation fog and ice fog.,Steam fog and ground fog. ,Advection fog and upslope fog. 
1171,,,Low-level turbulence can  occur and icing can become hazardous in which type of fog?,C,Rain-induced fog. ,Upslope fog.,Steam fog. 
1172,,,What is the best way for a remote pilot to determine the likelihood of local fog formation?,A,Monitor the temperature/dew point spread.,Monitor the wind conditions to insure the wind speed is not increasing. ,Monitor the barometric pressure to insure that it is not decreasing.
1173,,,How would high density altitude affect the performance  of a small unmanned aircraft?,C,No change in performance. ,Increased performance. ,Decrease performance. 
1174,,,"If the outside air temperature (OAT) at a given altitude is warmer than stardard, the density altitude is ",C,equal to pressure altitude. ,lower than pressure altitude.,higher than pressure altitude.
1175,,,What are the standard temperature and pressure values for sea level?,A,"15°C and 29.92"" Hg",59°C and 1013.2 millibars.,59°F and 29.92 milibars.
1176,,,Which factor would tend to increase the density altitude at a given airport referenced in the weather briefing?,B,An increase in barometric pressure., An increase in ambient temperture.,A decrease in relative humidity.
1177,,,What effect does high density altitude have on the efficiency of a UA propellor?,B,Propellor efficienct is increased. ,Propeller efficienct is decreased.,Density altitude does not affect propeller efficiency. 
1290,,,What effect does humidity have on performace?,C,It has no effect on performace.,It increases performace. ,It decreases performance.
1178,,,"To get a complete weather overview for the planned flight, the remote pilot in command should obtain",C,An outlook brief.,An abbreviated briefing.,A standard briefing. 
1179,,,Which statement is true concerning ASOS/AWOS weather reporting systems?,B,Each AWOS station is part of a nationwide network of weather reporting stations. ,ASOS locations perform weather observing functions necessary to generate METAR reports.,"Both ASOS ans AWOS have the capability of reporting desity altitude, as long as it exceeds the airport elevation by more than 1,000 feet."
1180,(Refer to Figure 12.),,The wind direction and velocity at KJFK is from:,A ,180° true at 4 knots. ,180° magnetic at 4 knots.,040° true at 18 knots
1181,(Refer to Figure 12.),,What are the current conditions for Chicago Midway Airport (KMDW)?,A,"Sky 700 feet overcast, visibility 1-1/2 SM, rain. ","Sky 7,000 feet overcast, visibility 1-1/2SM, heavy rain. ","Sky 700 feet overcast, visibility 11, occasionally 2 sm, with rain. "
1182,(Refer to Figure 15.) ,,"In the TAF for KMEM, what does ""SHRA"" stand for?",A,Rain Showers ,A shift in wind direction is expected. ,A significican change in precipitation is possible. 
1183,(Refer to Figure 15.),,Between 1000Z and 1200Z the visibility at KMEM is forecast to be ,B,1/2 statute mile. ,3 statute miles.,6 statute miles.
